{
  "schemaVersion": "1.0.0",
  "note": "Seeded from open-vehicle/_proposed/styles (catalog-scoped Layer 3). Use with npm run data:nhtsa:project --compare-baseline.",
  "aggregationSource": "projected",
  "counts": {
    "acura": {
      "models": 1,
      "styles": 0
    },
    "alfa_romeo": {
      "models": 1,
      "styles": 0
    },
    "aston_martin": {
      "models": 2,
      "styles": 6
    },
    "audi": {
      "models": 3,
      "styles": 61
    },
    "bmw": {
      "models": 11,
      "styles": 36
    },
    "bugatti": {
      "models": 1,
      "styles": 0
    },
    "chevrolet": {
      "models": 3,
      "styles": 26
    },
    "dodge": {
      "models": 1,
      "styles": 0
    },
    "ferrari": {
      "models": 5,
      "styles": 11
    },
    "fiat": {
      "models": 1,
      "styles": 9
    },
    "ford": {
      "models": 3,
      "styles": 0
    },
    "honda": {
      "models": 4,
      "styles": 0
    },
    "hyundai": {
      "models": 2,
      "styles": 1
    },
    "infiniti": {
      "models": 1,
      "styles": 5
    },
    "lamborghini": {
      "models": 3,
      "styles": 16
    },
    "lexus": {
      "models": 1,
      "styles": 1
    },
    "lotus": {
      "models": 2,
      "styles": 7
    },
    "mazda": {
      "models": 1,
      "styles": 10
    },
    "mini": {
      "models": 1,
      "styles": 37
    },
    "mitsubishi": {
      "models": 3,
      "styles": 45
    },
    "nissan": {
      "models": 2,
      "styles": 3
    },
    "pontiac": {
      "models": 4,
      "styles": 40
    },
    "porsche": {
      "models": 4,
      "styles": 109
    },
    "saab": {
      "models": 2,
      "styles": 42
    },
    "smart": {
      "models": 1,
      "styles": 0
    },
    "subaru": {
      "models": 4,
      "styles": 2
    },
    "tesla": {
      "models": 1,
      "styles": 0
    },
    "toyota": {
      "models": 3,
      "styles": 0
    },
    "triumph": {
      "models": 1,
      "styles": 1
    },
    "volvo": {
      "models": 1,
      "styles": 11
    }
  }
}
